{
  "schema_version": "1.0",
  "instrument_id": "guitar.standard.6",
  "display_name": "Six-String Guitar",
  "family": "guitar",
  "fingerboard_mode": "fretted",
  "scale_length_mm": 648.0,
  "fret_count": 22,
  "strings": [
    { "string_id": "string-1", "display_label": "1", "display_order": 1, "open_midi_note": 64, "course_id": null, "enabled": true, "max_position": null },
    { "string_id": "string-2", "display_label": "2", "display_order": 2, "open_midi_note": 59, "course_id": null, "enabled": true, "max_position": null },
    { "string_id": "string-3", "display_label": "3", "display_order": 3, "open_midi_note": 55, "course_id": null, "enabled": true, "max_position": null },
    { "string_id": "string-4", "display_label": "4", "display_order": 4, "open_midi_note": 50, "course_id": null, "enabled": true, "max_position": null },
    { "string_id": "string-5", "display_label": "5", "display_order": 5, "open_midi_note": 45, "course_id": null, "enabled": true, "max_position": null },
    { "string_id": "string-6", "display_label": "6", "display_order": 6, "open_midi_note": 40, "course_id": null, "enabled": true, "max_position": null }
  ],
  "reference_markers": [
    { "marker_id": "inlay-3", "semitone_offset": 3, "label": "3" },
    { "marker_id": "inlay-5", "semitone_offset": 5, "label": "5" },
    { "marker_id": "inlay-7", "semitone_offset": 7, "label": "7" },
    { "marker_id": "inlay-9", "semitone_offset": 9, "label": "9" },
    { "marker_id": "inlay-12", "semitone_offset": 12, "label": "12" },
    { "marker_id": "inlay-15", "semitone_offset": 15, "label": "15" },
    { "marker_id": "inlay-17", "semitone_offset": 17, "label": "17" },
    { "marker_id": "inlay-19", "semitone_offset": 19, "label": "19" },
    { "marker_id": "inlay-21", "semitone_offset": 21, "label": "21" }
  ],
  "metadata": {
    "tuning_name": "standard",
    "note": "E2 A2 D3 G3 B3 E4; string 1 is the high E, per conventional guitar numbering."
  }
}
